{
  "schema_version": "rules-residue.m2.external-evidence-supplement/1.0",
  "supplement_id": "M2-B001-EXT-001",
  "nature": "EXTERNAL_EVIDENCE_SUPPLEMENT",
  "batch_id": "M2-B001",
  "created_at": "2026-08-13T08:54:30Z",
  "accepted_b001_binding": {
    "accepted_commit": "fdc1f4c9d8bc565888f33b44684cd6ccbe80c127",
    "accepted_tree": "f37e15cdd65e0a39eebcddb21f56a2c58ae6939e",
    "historical_result_path": "reports/m2/probes/probe-results.json",
    "historical_result_sha256": "154e7c0ddf8ce7b2243ad6c78d10ceb6cddf02c3aeb6592716dcc5ad8fc64218",
    "historical_manifest_path": "reports/m2/probes/evidence-manifest.json",
    "historical_manifest_sha256": "3a48da621e45980d9b2258513954e1f29480fd9e12a35dcd29c12b77015c8ca7"
  },
  "route_binding": {
    "request_path": ".codex/routes/m2-b001-external-probe-update-request.json",
    "route_id": "M2-B001-EXTERNAL-PROBE-UPDATE-001",
    "mode": "IMPLEMENT",
    "milestone": "M2",
    "batch_id": "M2-B001",
    "source_commit": "fdc1f4c9d8bc565888f33b44684cd6ccbe80c127",
    "source_tree": "f37e15cdd65e0a39eebcddb21f56a2c58ae6939e",
    "binding_digest": "12fc07fa8a582c335c87a909795146f41625e182da81ff3383b5a31311a9cb05",
    "context_status": "OK",
    "context_ratio": 0.4256642659505208,
    "freshness_status": "PASS",
    "checked_at": "2026-08-13T08:39:23Z",
    "command_id": "ROUTE_FRESHNESS"
  },
  "external_binding": {
    "name": "TRPG_PLATFORM",
    "repository": "/home/zyc14588/TRPG_PLATFORM",
    "branch": "m1/b002-lua-runtime",
    "commit": "02dd02447ed07fe6248108365847dccf4023ca00",
    "tree": "dc15acda453948fc78afdc259fea3e543f9e001c",
    "tracked_worktree_clean_before": true,
    "tracked_worktree_clean_after": true,
    "identity_command_ids": {
      "before": ["PLATFORM_PRE_STATUS", "PLATFORM_PRE_BRANCH", "PLATFORM_PRE_COMMIT", "PLATFORM_PRE_TREE"],
      "after": ["PLATFORM_POST_STATUS", "PLATFORM_POST_BRANCH", "PLATFORM_POST_COMMIT", "PLATFORM_POST_TREE"]
    }
  },
  "command_evidence": "reports/m2/probes/external/m2-b001-ext-001/platform-command-evidence.json",
  "probe_result_transitions": [
    {
      "probe_id": "R2-INT-001",
      "probe_execution": "RETAINED_NO_RETEST",
      "previous": {
        "execution_status": "FAIL",
        "evidence_paths": ["tests/m2/probes/fixtures/local-capability-vectors.json", "tests/m2/probes/fixtures/platform-manifest-seat.toml", "reports/m2/probes/platform-inventory.json", "workflow/queue/m2-b001-trpg-platform-probes.json", "workflow/queue/m2-b001-creator-tool-probes.json"],
        "target_results": [
          {"target": "A:rules-residue", "execution_status": "PASS", "evidence_paths": ["tests/m2/probes/fixtures/local-capability-vectors.json"]},
          {"target": "B:TRPG_PLATFORM", "execution_status": "FAIL", "evidence_paths": ["reports/m2/probes/platform-inventory.json"]},
          {"target": "C:Creator Tool", "execution_status": "BLOCKED_EXTERNAL", "evidence_paths": ["reports/m2/probes/platform-inventory.json"]}
        ],
        "downstream_blocked_batches": ["M2-B006", "M2-B015", "M2-B016"]
      },
      "new": {
        "execution_status": "FAIL",
        "evidence_paths": ["tests/m2/probes/fixtures/local-capability-vectors.json", "tests/m2/probes/fixtures/platform-manifest-seat.toml", "reports/m2/probes/platform-inventory.json", "workflow/queue/m2-b001-trpg-platform-probes.json", "workflow/queue/m2-b001-creator-tool-probes.json"],
        "target_results": [
          {"target": "A:rules-residue", "execution_status": "PASS", "evidence_paths": ["tests/m2/probes/fixtures/local-capability-vectors.json"]},
          {"target": "B:TRPG_PLATFORM", "execution_status": "FAIL", "evidence_paths": ["reports/m2/probes/platform-inventory.json"]},
          {"target": "C:Creator Tool", "execution_status": "BLOCKED_EXTERNAL", "evidence_paths": ["reports/m2/probes/platform-inventory.json"]}
        ],
        "downstream_blocked_batches": ["M2-B006", "M2-B015", "M2-B016"]
      },
      "transition_reason": "Historical FAIL is retained without automatic retest or reclassification; no new directly relevant complete seat-lifecycle evidence was admitted. It is not a B002 blocker.",
      "command_ids": []
    },
    {
      "probe_id": "R2-INT-002",
      "probe_execution": "EXECUTED",
      "previous": {
        "execution_status": "BLOCKED_EXTERNAL",
        "evidence_paths": ["tests/m2/probes/fixtures/local-capability-vectors.json", "reports/m2/probes/platform-inventory.json", "workflow/queue/m2-b001-trpg-platform-probes.json"],
        "target_results": [
          {"target": "A:rules-residue", "execution_status": "PASS", "evidence_paths": ["tests/m2/probes/fixtures/local-capability-vectors.json"]},
          {"target": "B:TRPG_PLATFORM", "execution_status": "BLOCKED_EXTERNAL", "evidence_paths": ["reports/m2/probes/platform-inventory.json"]}
        ],
        "downstream_blocked_batches": ["M2-B006", "M2-B015", "M2-B016"]
      },
      "new": {
        "execution_status": "BLOCKED_EXTERNAL",
        "evidence_paths": ["tests/m2/probes/fixtures/local-capability-vectors.json", "reports/m2/probes/platform-inventory.json", "workflow/queue/m2-b001-trpg-platform-probes.json", "reports/m2/probes/external/m2-b001-ext-001/platform-command-evidence.json"],
        "target_results": [
          {"target": "A:rules-residue", "execution_status": "PASS", "evidence_paths": ["tests/m2/probes/fixtures/local-capability-vectors.json"]},
          {"target": "B:TRPG_PLATFORM", "execution_status": "BLOCKED_EXTERNAL", "evidence_paths": ["reports/m2/probes/external/m2-b001-ext-001/platform-command-evidence.json"]}
        ],
        "downstream_blocked_batches": ["M2-B006", "M2-B015", "M2-B016"]
      },
      "transition_reason": "The fixed platform executes only a non-playable M0 host shell and exposes no participant/deceased projection or action-policy surface; private tether and whitelist lifecycle remain unavailable.",
      "command_ids": ["PLATFORMD_HEALTH", "PLATFORMD_HELP", "CAPABILITY_SCAN_GENERAL", "CAPABILITY_SCAN_HOST_SURFACES"]
    },
    {
      "probe_id": "R2-INT-003",
      "probe_execution": "EXECUTED",
      "previous": {
        "execution_status": "BLOCKED_EXTERNAL",
        "evidence_paths": ["tests/m2/probes/fixtures/local-capability-vectors.json", "reports/m2/probes/platform-inventory.json", "workflow/queue/m2-b001-trpg-platform-probes.json"],
        "target_results": [
          {"target": "A:rules-residue", "execution_status": "PASS", "evidence_paths": ["tests/m2/probes/fixtures/local-capability-vectors.json"]},
          {"target": "B:TRPG_PLATFORM", "execution_status": "BLOCKED_EXTERNAL", "evidence_paths": ["reports/m2/probes/platform-inventory.json"]}
        ],
        "downstream_blocked_batches": ["M2-B010", "M2-B012", "M2-B015"]
      },
      "new": {
        "execution_status": "BLOCKED_EXTERNAL",
        "evidence_paths": ["tests/m2/probes/fixtures/local-capability-vectors.json", "reports/m2/probes/platform-inventory.json", "workflow/queue/m2-b001-trpg-platform-probes.json", "reports/m2/probes/external/m2-b001-ext-001/platform-command-evidence.json"],
        "target_results": [
          {"target": "A:rules-residue", "execution_status": "PASS", "evidence_paths": ["tests/m2/probes/fixtures/local-capability-vectors.json"]},
          {"target": "B:TRPG_PLATFORM", "execution_status": "BLOCKED_EXTERNAL", "evidence_paths": ["reports/m2/probes/external/m2-b001-ext-001/platform-command-evidence.json"]}
        ],
        "downstream_blocked_batches": ["M2-B010", "M2-B012", "M2-B015"]
      },
      "transition_reason": "No Host action lifecycle or UI integration exists on the executable platform surface, so exact-intent commit/no-popup behavior cannot be integrated or audited.",
      "command_ids": ["PLATFORMD_HEALTH", "PLATFORMD_HELP", "CAPABILITY_SCAN_HOST_SURFACES"]
    },
    {
      "probe_id": "R2-INT-004",
      "probe_execution": "EXECUTED",
      "previous": {
        "execution_status": "BLOCKED_EXTERNAL",
        "evidence_paths": ["tests/m2/probes/fixtures/local-capability-vectors.json", "reports/m2/probes/platform-inventory.json", "workflow/queue/m2-b001-trpg-platform-probes.json"],
        "target_results": [
          {"target": "A:rules-residue", "execution_status": "PASS", "evidence_paths": ["tests/m2/probes/fixtures/local-capability-vectors.json"]},
          {"target": "B:TRPG_PLATFORM", "execution_status": "BLOCKED_EXTERNAL", "evidence_paths": ["reports/m2/probes/platform-inventory.json"]}
        ],
        "downstream_blocked_batches": ["M2-B008", "M2-B010", "M2-B015"]
      },
      "new": {
        "execution_status": "BLOCKED_EXTERNAL",
        "evidence_paths": ["tests/m2/probes/fixtures/local-capability-vectors.json", "reports/m2/probes/platform-inventory.json", "workflow/queue/m2-b001-trpg-platform-probes.json", "reports/m2/probes/external/m2-b001-ext-001/platform-command-evidence.json"],
        "target_results": [
          {"target": "A:rules-residue", "execution_status": "PASS", "evidence_paths": ["tests/m2/probes/fixtures/local-capability-vectors.json"]},
          {"target": "B:TRPG_PLATFORM", "execution_status": "BLOCKED_EXTERNAL", "evidence_paths": ["reports/m2/probes/external/m2-b001-ext-001/platform-command-evidence.json"]}
        ],
        "downstream_blocked_batches": ["M2-B008", "M2-B010", "M2-B015"]
      },
      "transition_reason": "The Host has no warning-category/rendering contract and Creator Studio has no controls; platform safety warnings cannot be executed separately from puzzle signals.",
      "command_ids": ["PLATFORMD_HEALTH", "PLATFORMD_HELP", "CREATOR_SHELL_TEST", "CAPABILITY_SCAN_HOST_SURFACES"]
    },
    {
      "probe_id": "R2-INT-005",
      "probe_execution": "EXECUTED",
      "previous": {
        "execution_status": "BLOCKED_EXTERNAL",
        "evidence_paths": ["tests/m2/probes/fixtures/local-capability-vectors.json", "reports/m2/probes/platform-inventory.json", "workflow/queue/m2-b001-trpg-platform-probes.json"],